[
  {
    "id": "tk1a-1",
    "name": "Bagon",
    "supertype": "Pokémon",
    "subtypes": [
      "Basic"
    ],
    "hp": "40",
    "types": [
      "Colorless"
    ],
    "evolvesTo": [
      "Shelgon"
    ],
    "attacks": [
      {
        "name": "Headbutt",
        "cost": [
          "Colorless"
        ],
        "convertedEnergyCost": 1,
        "damage": "10",
        "text": ""
      },
      {
        "name": "Flare",
        "cost": [
          "Fire",
          "Colorless"
        ],
        "convertedEnergyCost": 2,
        "damage": "20",
        "text": ""
      }
    ],
    "retreatCost": [
      "Colorless"
    ],
    "convertedRetreatCost": 1,
    "number": "1",
    "artist": "Ken Sugimori",
    "nationalPokedexNumbers": [
      371
    ],
    "legalities": {
      "unlimited": "Legal"
    },
    "images": {
      "small": "https://images.pokemontcg.io/tk1a/1.png",
      "large": "https://images.pokemontcg.io/tk1a/1_hires.png"
    }
  },
  {
    "id": "tk1a-2",
    "name": "Combusken",
    "supertype": "Pokémon",
    "subtypes": [
      "Stage 1"
    ],
    "hp": "70",
    "types": [
      "Fire"
    ],
    "evolvesFrom": "Torchic",
    "evolvesTo": [
      "Blaziken"
    ],
    "attacks": [
      {
        "name": "Flare",
        "cost": [
          "Fire"
        ],
        "convertedEnergyCost": 1,
        "damage": "20",
        "text": ""
      },
      {
        "name": "Double Kick",
        "cost": [
          "Colorless",
          "Colorless",
          "Colorless"
        ],
        "convertedEnergyCost": 3,
        "damage": "40×",
        "text": "Flip 2 coins. This attack does 40 damage times the number of heads."
      }
    ],
    "weaknesses": [
      {
        "type": "Water",
        "value": "×2"
      }
    ],
    "retreatCost": [
      "Colorless"
    ],
    "convertedRetreatCost": 1,
    "number": "2",
    "artist": "Kouki Saitou",
    "nationalPokedexNumbers": [
      256
    ],
    "legalities": {
      "unlimited": "Legal"
    },
    "images": {
      "small": "https://images.pokemontcg.io/tk1a/2.png",
      "large": "https://images.pokemontcg.io/tk1a/2_hires.png"
    }
  },
  {
    "id": "tk1a-3",
    "name": "Delcatty",
    "supertype": "Pokémon",
    "subtypes": [
      "Stage 1"
    ],
    "hp": "80",
    "types": [
      "Colorless"
    ],
    "evolvesFrom": "Skitty",
    "attacks": [
      {
        "name": "Scratch",
        "cost": [
          "Colorless",
          "Colorless"
        ],
        "convertedEnergyCost": 2,
        "damage": "30",
        "text": ""
      },
      {
        "name": "Ultra Energy Source",
        "cost": [
          "Colorless",
          "Colorless",
          "Colorless"
        ],
        "convertedEnergyCost": 3,
        "damage": "10×",
        "text": "Does 10 damage times the number of basic Energy cards attached to all of the Active Pokémon (both yours and your opponent's)."
      }
    ],
    "weaknesses": [
      {
        "type": "Fighting",
        "value": "×2"
      }
    ],
    "retreatCost": [
      "Colorless"
    ],
    "convertedRetreatCost": 1,
    "number": "3",
    "artist": "Midori Harada",
    "nationalPokedexNumbers": [
      301
    ],
    "legalities": {
      "unlimited": "Legal"
    },
    "images": {
      "small": "https://images.pokemontcg.io/tk1a/3.png",
      "large": "https://images.pokemontcg.io/tk1a/3_hires.png"
    }
  },
  {
    "id": "tk1a-4",
    "name": "Latias",
    "supertype": "Pokémon",
    "subtypes": [
      "Basic"
    ],
    "hp": "70",
    "types": [
      "Colorless"
    ],
    "attacks": [
      {
        "name": "Dragon Dew",
        "cost": [
          "Fire"
        ],
        "convertedEnergyCost": 1,
        "damage": "10",
        "text": "Remove 1 damage counter from 1 of your Pokémon"
      },
      {
        "name": "Heat Blast",
        "cost": [
          "Fire",
          "Fire",
          "Colorless"
        ],
        "convertedEnergyCost": 3,
        "damage": "40",
        "text": ""
      }
    ],
    "weaknesses": [
      {
        "type": "Psychic",
        "value": "×2"
      }
    ],
    "retreatCost": [
      "Colorless"
    ],
    "convertedRetreatCost": 1,
    "number": "4",
    "artist": "Nakaoka",
    "nationalPokedexNumbers": [
      380
    ],
    "legalities": {
      "unlimited": "Legal"
    },
    "images": {
      "small": "https://images.pokemontcg.io/tk1a/4.png",
      "large": "https://images.pokemontcg.io/tk1a/4_hires.png"
    }
  },
  {
    "id": "tk1a-5",
    "name": "Numel",
    "supertype": "Pokémon",
    "subtypes": [
      "Basic"
    ],
    "hp": "40",
    "types": [
      "Fire"
    ],
    "evolvesTo": [
      "Camerupt"
    ],
    "attacks": [
      {
        "name": "Firebreathing",
        "cost": [
          "Fire"
        ],
        "convertedEnergyCost": 1,
        "damage": "10+",
        "text": "Flip a coin. If heads, this attack does 10 damage plus 10 more damage."
      },
      {
        "name": "Tackle",
        "cost": [
          "Colorless",
          "Colorless"
        ],
        "convertedEnergyCost": 2,
        "damage": "20",
        "text": ""
      }
    ],
    "weaknesses": [
      {
        "type": "Water",
        "value": "×2"
      }
    ],
    "retreatCost": [
      "Colorless"
    ],
    "convertedRetreatCost": 1,
    "number": "5",
    "artist": "Yuka Morii",
    "nationalPokedexNumbers": [
      322
    ],
    "legalities": {
      "unlimited": "Legal"
    },
    "images": {
      "small": "https://images.pokemontcg.io/tk1a/5.png",
      "large": "https://images.pokemontcg.io/tk1a/5_hires.png"
    }
  },
  {
    "id": "tk1a-6",
    "name": "Skitty",
    "supertype": "Pokémon",
    "subtypes": [
      "Basic"
    ],
    "hp": "50",
    "types": [
      "Colorless"
    ],
    "evolvesTo": [
      "Delcatty"
    ],
    "attacks": [
      {
        "name": "Tackle",
        "cost": [
          "Colorless"
        ],
        "convertedEnergyCost": 1,
        "damage": "10",
        "text": ""
      },
      {
        "name": "Lunge",
        "cost": [
          "Colorless",
          "Colorless"
        ],
        "convertedEnergyCost": 2,
        "damage": "30",
        "text": "Flip a coin. If tails, this attack does nothing."
      }
    ],
    "weaknesses": [
      {
        "type": "Fighting",
        "value": "×2"
      }
    ],
    "retreatCost": [
      "Colorless"
    ],
    "convertedRetreatCost": 1,
    "number": "6",
    "artist": "Atsuko Nishida",
    "nationalPokedexNumbers": [
      300
    ],
    "legalities": {
      "unlimited": "Legal"
    },
    "images": {
      "small": "https://images.pokemontcg.io/tk1a/6.png",
      "large": "https://images.pokemontcg.io/tk1a/6_hires.png"
    }
  },
  {
    "id": "tk1a-7",
    "name": "Torchic",
    "supertype": "Pokémon",
    "subtypes": [
      "Basic"
    ],
    "hp": "50",
    "types": [
      "Fire"
    ],
    "evolvesTo": [
      "Combusken"
    ],
    "attacks": [
      {
        "name": "Firebreathing",
        "cost": [
          "Fire",
          "Colorless"
        ],
        "convertedEnergyCost": 2,
        "damage": "20+",
        "text": "Flip a coin. If heads, this attack does 20 damage plus 20 more damage."
      }
    ],
    "weaknesses": [
      {
        "type": "Water",
        "value": "×2"
      }
    ],
    "retreatCost": [
      "Colorless"
    ],
    "convertedRetreatCost": 1,
    "number": "7",
    "artist": "Hironobu Yoshida",
    "nationalPokedexNumbers": [
      255
    ],
    "legalities": {
      "unlimited": "Legal"
    },
    "images": {
      "small": "https://images.pokemontcg.io/tk1a/7.png",
      "large": "https://images.pokemontcg.io/tk1a/7_hires.png"
    }
  },
  {
    "id": "tk1a-8",
    "name": "Potion",
    "supertype": "Trainer",
    "subtypes": [
      "Item"
    ],
    "rules": [
      "Remove 2 damage counters from 1 of your Pokémon (remove 1 damage counter if that Pokémon has only 1)."
    ],
    "number": "8",
    "artist": "Keiji Kinebuchi",
    "legalities": {
      "unlimited": "Legal",
      "standard": "Legal",
      "expanded": "Legal"
    },
    "images": {
      "small": "https://images.pokemontcg.io/tk1a/8.png",
      "large": "https://images.pokemontcg.io/tk1a/8_hires.png"
    }
  },
  {
    "id": "tk1a-9",
    "name": "Energy Search",
    "supertype": "Trainer",
    "subtypes": [
      "Item"
    ],
    "rules": [
      "Search your deck for a basic Energy card, show it to your opponent, and put it into your hand. Shuffle your deck afterward"
    ],
    "number": "9",
    "artist": "Kai Ishikawa",
    "legalities": {
      "unlimited": "Legal",
      "standard": "Legal",
      "expanded": "Legal"
    },
    "images": {
      "small": "https://images.pokemontcg.io/tk1a/9.png",
      "large": "https://images.pokemontcg.io/tk1a/9_hires.png"
    }
  },
  {
    "id": "tk1a-10",
    "name": "Fire Energy",
    "supertype": "Energy",
    "subtypes": [
      "Basic"
    ],
    "number": "10",
    "legalities": {
      "unlimited": "Legal",
      "standard": "Legal",
      "expanded": "Legal"
    },
    "images": {
      "small": "https://images.pokemontcg.io/tk1a/10.png",
      "large": "https://images.pokemontcg.io/tk1a/10_hires.png"
    }
  }
]
